TAM04191011,"While sitting in the sales and décor center,  there should be informative videos while the reps are on the phone or helping others. Both the décor center and sale center need more education on what standard and what is offered as upgrades.  We spend a lot time waiting for the reps to find out answer while on the phone.  The reps should be able to answer most questions right away. 
A lot of wasted time.   
They need to be education on selection and construction. 
There should be an option to add items after  finalized décor selection, as sometimes we realize we would like a something more."
TAM0513119,"I think the worst thing for me is that when I went to the sales office I was told that the there was only one lot left and the next phase was going to be town homes and if I wanted to buy I need to buy that lot.  (which would not have been my option since it has a hydrant and utilities) I had explained very carefully to Deb that a large backyard was very important to me and my family.  You cannot image how devastated I was to see single homes with huge backyards become available less than 3 months after I bought.  It will forever taint how I feel about this home.  I have started thinking of moving out before I moved in and the associated cost of buying an Oxford with a larger lot.  As well, I was very very sad and still am that I did not get my smooth ceilings.  It was the one thing that I really wanted and I mentioned it first to Deb at the sales center and she wrote DC beside my wish list for certain items but it was so long between purchase (april) to going to the design center (october) that I thought I had already taken care of the smooth ceiling so I was really unhappy when I saw the stiple ceiling.  It is an overwhelming process and I wish someone would have taken my wish list and forwarded it to the design center.  it was confusing doing somethings with deb and others at the design center.  Another thing was that the stairs were not fully explained to me.  I thought the quote for the post was the one newel post for (2400$) not realizing it was for all of the posts, had I known that I would have upgraded.  I found Deb super nice till I bought then when I went in after I found out about the larger lots she was not so nice. This was supposed to be the house of my dreams, we were never going to move again.  But knowing that I could have had the backyard I wanted with Tamarack is painful.  Bittersweet."
TAM0815114,More options
TAM0913115,nothing.  it was excellent..
TAM1010106,Nothing
TAM1210118,Allow for changes to be made after the last design center meeting - perhaps charge 150 as other builders do
TAM06161027,"Design center team being just as enthusiastic as Jacqui. She was the reason we bought a Tamarack home. Jacqui's presentation to us sold us the first visit. Understanding that this is sometimes a first building a home, many people arent sure what to expect or don't know what others often choose for upgrades, changes etc. 
Overall your team is amazing. You do a great job and I have sent referrals your way!"
TAM06161010,Nothing.  It was all good.
TAM1212103,waiting in line to purchase the Lot#
TAM04171023,Nothing!  I was absolutely thrilled with the knowledge and level of service I received from the sales office and the design centre process!
TAM1113103,"Information at sales center was misleading. ""Bonus"" offer was turned and construed to make it appear as though the buyers were getting something additional for signing early whereas it was part of the standard features all along. It made the company appear dishonest."
TAM08181031,"Sales process was smooth and Marg was very friendly and helpful every time we visited her, always welcoming us with a smile. We didn't have the full 45 days for the design process, as it's my perception that Tamarack didn't handle properly the post-sales service. We had to proactively visit the design center 3 months after purchasing the home to inquire about when they will contact us for our appointments. It seems that we were contacted the week after only because we raised a flag about the short timeframe for our design process. Then, when we started with the design process we had less than 45 days to complete it, and we felt the rush to provide all the information and decide on things on a shorter timeframe, due to a lack of planning.

Our meeting at Concept wasn't a good one, not too much explanation on the things that we had to decide and what comes standard with the house. Also, no chance to change almost anything as most of the electrical wiring had already been done in the house, as per the Concept advisor, which didn't seem to be true when we visited the house for the first time. Also, no chance add a conduit to run cables through the wall in the living room area, instead they wanted to charge us per each HDMI cable that was required, which does not make much sense to me, but unfortunately due to the lack of options we had to accept. We will probably have to install a conduit ourselves when the time comes, if possible at all.

Ewa from Muskoka Cabinetry was very helpful in explaining our optional upgrades and assisting us through the process, however due to the lack of proper planning for our Design phase, we also felt the rush from her side to provide appliance models in less time than what was initially agreed on.

Morgan from the Design Center did a wonderful job and had a lot of patience explaining some of the options available for our home. I still feel that some questions were left unanswered, but we guess we will deal with those things after moving into the new house.

We were told that a Project Manager from Tamarack was assigned to follow up with us during the design process and solve any questions we may have. We only received a template congratulation letter in the mail after purchasing the house, and that was the last time we heard from the Project Manager at all. We are not complaining at all, but we expected more interaction if someone is assigned for this purpose, especially being first time buyers.

When we visited the house, some TV cable outlets weren't even installed yet, so we weren't able to confirm if we are getting everything that was agreed on. We also noticed that some of the electrical installations were recently performed (and still not completed) so it doesn't make sense that Concept didn't allow us to make any modifications to the original blueprint. A couple of potlights, which we were particularly very curious to see if they were correctly placed, weren't even installed on the day of our visit. We did receive protective gear (helmets), but not boots or glasses as stated in the survey, just wanted to mention why we placed a low score on that question. And by the way, the person who joined us from Tamarack for that visit, he did a wonderful job showing us around and explaining what we were seeing, he made sure we enjoyed our visit.

I hope these comments help on improving the experience for other first time buyers, small things that can make a huge difference."
TAM0716108,The samples were small. There should be a computer programme that allows you to see your selection in a virtual environment.
TAM12191009,"Nothing comes to mind in terms of suggestions for improvement. The initial list of upgrade options was appreciated and necessary for (pre) planning purposes, but the way in which it is formatted is somewhat confusing until the first design centre meeting."
TAM1015139,"Nothing at all, everything went smoothly."
TAM02182015,"I do not like the sales after I signed the contract. When I talk to them, it seems like I am idiotically. Anyway, it is very difficult to communicate with them."
TAM0915107,Noella was absolutely fantastic
TAM1215126,I would reduce the rate of the house.
TAM0213112,"Appliances to include with the house; OR increased design centre bonus to get appliances.

Great selection of standard options and availability.
Design centre experience was great.
Sales centre rep was very experienced and assisted with the purchase."
TAM0613113,"I really enjoyed going through the entire sales and design centre process, and definitely look forward to another Tamarack home!

The only thing that I'd like changed would be the addition of a timeline chart of the entire process (signing of initial agreement to closing day (and beyond). I understand that the ""Playbook"" outlines all these steps, but a chart would have been helpful for a visual learner like myself.

Thanks Tamarack!"
TAM0717106,Nothing
TAM1110110,"Unfortunately I was out of town due to death in the family when the sales office contacted me for the construction visit. I would had liked to do the inspection myself but was told that they couldn't wait the 3 days I was still going to be absent so the representative did it for me and assured me that everything noted on the contract had been verified and or modified. When returning to town a few days later, I was allowed to visit the interior of my house but the insulation and gypboard were already completed therefore could not verify certain options such as the reinforments for certain lights and placements of studs where I had a plug and conduit added in the kitchen for hanging a television. I did notice a few things that still have to be checked out such as the electrical boxes for the bathroom lights to be added and capped and telephone/cable outlet to be verified if there are going to be 2 of them in a certain room of if they forgot to add the 2nd outlet. Under these circumstances, it would had been nice to put off the visit a few days but understand the essence of time. I greatly appreciated the extra time and effort it took the sales representative to verify things for me and taking the time to call me to reassure me about this major step."
TAM0812139,Nothing. Debbie @ Sales & Kim @ Design Center were absolutely amazing. So was the whole Tamarack home buying process.
TAM1111122,I had some difficulty about being told 'yes we can' and signing to purchase...but only later to find out 'no we cant'
TAM07181025,"Sales: have the colour scheme boards available with accurate numbers before assigning to new buildings.  INCLUDE door colour on the boards.  We feel the door colour is not reflective of professional designers and makes a tasteful building look tacky and cheap. 

Design Centre: Ensure accuracy of the selections and they are recorded correctly.  Focus more on customer service.  We felt valued as customers at the sales centre but not so much at the design centre.  Want to highlight we did receive excellent customer service from Eliza and she should be recognised for this!"
TAM1210104,"We would like to have more time with our design consultant. We realize that we were free to browse on own our time; however, our design consultant was so much more knowledgeable about your selection and what worked best together than we were. It would have been wonderful to have more time to use her expertise."
TAM11171012,Make the staff be more pleasant.  The sales person.
TAM0816127,"Design Centre Process - we need more time! It's a bit overwhelming to make all of the selections in 3 meetings, especially when the initial one is more of a guided tour of the design centre.

Otherwise, loved the choices and available support!"
TAM05181010,Friendly and professional service.  Highly recommended!
TAM09181025,"Some things that I liked about Tamarack were also those that I disliked for different reasons. 

For example, the design process is very streamlined and quick. On the other hand, having such a strict approach to these appointments (offering 3 appointments), likely helps Tamarack to stay on track with their closing dates and avoids other hassles.   Thankfully we had a good idea of what we were looking for and prepared a lot outside of the three appointments. . If I could change something I think it would be that design appointments have some flex, depending on the amount of upgrades being done to the home. 

One other change I would consider making is a bit more ease to reach a design rep/centre via telephone. Some conversations are much easily expressed via phone as opposed to email but it seemed that phone lines were not answered.  If we left a message, this would be returned via email. 


All in all, we're very happy with the end result of our design choices and hope that these translate properly to the house."
TAM0815108,open on fridays
TAM10171035,Have an office on the west side of Ottawa to do upgrades and not have son May meetings
TAM0713109,"Nothing to this point.

Note:  Bought a house already built.  No selection or construction walk through."
TAM12171001,"A better way to check and ensure that all selections made at the design centre were correct. The purchaser having more details and matching of item numbers with the sign-off sheet.  Our only issue with this entire process were the interior doors that my family, all of three of us, feel are the wrong doors that have been installed in our home.   The people who work for Tamarack are all amazing people, the most helpful and truly lovely people to deal with.  We received several calls to deal with the situation but at this time, we have family issue back home six hours away and can't deal with this now.  We don't want to fight with anyone."
TAM10191054,N/A
TAM0515106,They did not give us enough options for the colors of the house. I did not know I had to pay extra if I chose a different color in a room.   The sales lady did not tell me about extra cost only after I signed and paid.
TAM0611119,"Sales process was unorganized when it came time for the lot release, I was one of many who slept outside experienced the chaos on the release date...   One or two more appointments with the designer would have been beneficial.  The length of time to complete the design process was too short and the time to receive pricing was too long.  I also wish Tamarack would consider some exceptions past the cut off time. Also, this day and age people mount their TV's above the firecplace, I was surprised during the frame walk through thatTamarack doesn't account for this with the addition of a few extra 2x4's for wall mounts, this should be standard, I am still waiting to find out if this was added to our home after notifying our sales rep.  All in all the experience was good, we look forward to moving in to our new home !"
TAM0610123,"The only thing I can recommend is to have better communication and knowledge between sale, design center and Contractor. Just to make it easier when there are questions that there are better knowledge as oppose to sending you somewhere else for an answer"
TAM03182004,interactive App that would show you how everything is going to look.
TAM0809103,"Very well organized, thoughtful and warm welcoming."
TAM0414117,Perhaps a little more time to choose
TAM0610144,"There is nothing wrong with the current process. If have to come up with new ideas, we would like to see a writing schedule for each steps after contract being signed. The schedule will tell us when we need to arrange the mortgage, each steps of working in design center, frame check etc..  That schedule will make whole process more transparent.  But the current process is working well."
TAM1111146,That the workers are notified about what should and should not be removed according to the purchase and sales agreement of the buyer.  Lanscaping/shrubs and patio stones were removed at the front of my house that should have remained as per my sales agreement.  It was replaced with grass that I am not happy with.
TAM0610100,"1) Appointment Process: I do agree that 45 days are guidelines but it could be respected by providing second appointment within 30 days not after 40 days that what happen in my case, which would delay my closing date.
and that has cost you little extra on your interest payment.
2) Site Supervisor supposed to check the work of contractor against the design drawing.In my case, Contractor has installed the Fireplace according to sales drawing, which has resulted in rework of many people.

Thanks for considering my opinion."
TAM1015105,Air conditioning I got caught at last minute during the frame check.  The design centre didn't tell us if we didn't take air conditioning right then that they would have to tear down one of the ceilings.  I had 48 hours to get the approval for air conditioning.  I had to pay out of pocket rather than put it on the mortgage.  It was a hassle.  In the upgrades I had to really check the billing on it due to many errors.  If I hadn't owned a home before my daughter would have been very overwhelmed.  I wasn't impressed with the design centre.  She was nice but she should know her job.  The sales people were good though
TAM08181023,Design center we felt we were rushed. It seemed when the our appointment time was up we were rushed.
TAM0909123,A computer program to show how the colors and designs chosen look all put together and access to it from home before the meeting.
TAM1111115,"I would not be so greedy in the markup applied at the design centre.

From crazy lot premiums, ceramic baseboards priced illogically (and when they responded their response had holes in t it and did not even have the courtesy to reply to my email pointing out their mis-calculation), to $240 for a shower light - home depot less than $100 - and it doesn't even include a switch, to Moen curtain rods marked up about 500%, etc....

I realize Tamarack is a track builder and they can do this b/c they 'can' and people will pay for it... they still need to realize that nobody forgets being gouged and they are already being paid quite well for the home itself.

Like I said... be LESS greedy and YOU will SELL MORE homes and the people who buy them from you will be much happier in the process and will make more referrals... otherwise its a short term vision and people will eventually get tired of being raked and will go elsewhere..."
TAM0415103,Be able to visit our unit once every week or two. To see how things are moving along.
TAM1213112,I was not impressed with the way they installed the brick from outside there is a lots of cracks and dents!!
TAM08181003,The hours at the sale centre should start earlier. Base options are inadequate. When I asked about the taxes on the upgrades I could not get a straight answer! Some of the upgrade prices were ridiculous. I wanted to upgrade to laminate in the basement since my husband has asthma and the price that was given was outrageous. And no credit was being given back for the carpet. It would be nice to be able to have an approximate final price of your house prior to purchasing it. I found that a lot of things “needed” to be upgraded and we ended up going over our budget.
TAM0913100,"There's not really anything that we would change, everyone was nice and everything went well.
But it was always really hard to schedule an apointment.
Apart from that everything was great."
TAM1013120,NA
TAM0211102,"I would have appreciated the initial options that were available over and above elevation, lot, brick color etc. such as door styles etc. to be offered similiar to how options are presented at the design center."
TAM06161005,Make the option catalogue more clear with regards to kitchen cabinets.  It was very misleading.  Other than that our experience was amazing. Mandy Mason at the design centre and Noella Francoeur of the sales centre were excellent and very impressive with their knowledge and customer service.
TAM1014111,"I had to deal with a few frustrations related to the design process.  I found that there were not enough choices for countertops with the colours I was choosing with cabinets, flooring, etc.  Nothing matched, and I ended up choosing things I will probably replace.  It would have been nice to be able to go to a company for more options, like we could for ceramic for example.

Also, after choosing my hardwood, I was told later that I could not have it anymore because the hardwood company had been changed for my house.  This ended up being very frustrating and ended up costing me more than 1000$ extra which was not planned because I could not find anything that matched my cabinets and other selections with the new floorings available with the new company.  I had to upgrade to get something similar to what I had originally chosen with the initial hardwoods.  

Other than that, things have been good so far.  I look forward to seeing the final product."
TAM05181013,I was not being updated sooner about my house closing date. To this date I still have not received any response regarding this issue so I don’t know when the house can be closed and when I expect to have a frame walkthrough. Maybe it is better that someone can explain it to me.
TAM0514104,Notification of items that are going to be discontinued
TAM1110133,"1) Clients should be better aware that structural changes cannot be made once the city has approved the plans.Clients should be more aware of what constitutes a structural change.

EXAMPLE :It was at this stage that we decided to have hardwood added to the stair step treads and have the risers and stringer painted white. 

We were told that this was a structural change because we were now changing the height of the riser. 

Even though the contractor had yet to start making the stairs we were told that this could not be done.Now we are stuck with something that will cost us about $8000.00 to change after construction. 

2) Roof vents should be upgraded by builder and standard in all homes. The plastic mushroom caps are poor quality and look low grade on these homes. Even Mattamy is using the better flute type vents.This comment has been made by several new owners that we have met .

Regards 
Mark"
TAM0612113,"It is our second time building a new house, and overall we are satisfied, but the biggest take-away from our experience with Tamarack is that there isn't much flexibility.

- Having more flexibility when it comes to options such as lighting and handles would have been appreciated.  It would be nice if we could have chosen our own handles/lights and have had the builder install them. 

- Prices for upgrades are very expensive (i.e. garage door opener, under-cabinet lighting, etc.) and greatly discouraged us from choosing them.  Had the prices been reasonable, we likely would have purchased these items from you instead of from a third party.

- Having more flexibility when it comes to the closing date would have been nice.  When the house is built and waiting for the interior design, +/- a couple of days should not be the end of the world when the closing date is three months away. (Our last builder did all the interior in three weeks!)

- Throughout the buying process, Tera was amazing, very helpful, and always available.  She gave us a lot of ideas, information, personal experience which helped us in our decisions.

- The staff in general was knowledgeable and nice."
TAM0812125,"""It would have been useful to have had more time with the design consultant.

Also, our home has been sitting at a much advanced phase of construction than the home next to us however, they have an earlier closing date.  We were under the impression that changing our closing date should not be a problem but were later told that you 'do not change closing dates'.  As a result of our military relocation, we will be homeless (seemingly unnecessarily) for 6 weeks.  We are likely moving back to Kingston next summer but will likely reconsider buying building through Tamarack because of the lack of consideration and absence of a reasonable explanation."""
TAM07191045,"There are a few things I want to comment.

(1) During the sale process in June 2018, one of the bonus your salesperson highlighted was a 6-month free Internet + TV package which is worth around $1000. This was printed black and white in my contract. However, now July 2019, I found out Cogeco no longer has this deal. In between, I was not informed about this change by Tamarack Homes. Anyway, I think this promotion is very misleading, which led to my disappointment.

(2) During the sale process, there was no mention that Tamarack Homes won't install eavestroughs. It's also not an option for a upgrade. I mean I put my trust in a professional builder like Tamarack, at least let me know in advance. I found out about the missing eavestroughs during a raining day when I visited the site and I saw large amount of water dripping from the roof right above my garage door. This is another not-so-pleasant surprise. As a buyer, I want transparency. Salespersons should not just focus on what the builder will build, but also what the builder won't build. 

(3) There are a few things lost during the communications, such as a missing laundry tub in the basement, a wrong sink was removed in a bathroom. These errors were quickly corrected. I just thought if there were better communications between your sales persons and site stuff, a lot of errors could be avoided. In turn, it will make both your staff and my whole home purchasing experience less stressful. Anyway, I want to say there is room for improvement.     

(4) Finally, the design of this survey. The term ""Frame Check Walk-Through"" is being used in the survey. What I had was a ""Mechanical  Walk-Through"". I figured out the two terms are probably refer to the same activity. However, it can cause some confusions to non-professionals like myself."
TAM1016120,"More sales representatives available to help at design centre.
New standard choices that are more ""up to date""
New design centre location as the building is falling apart and was leaking on us during our visits.
On time construction.
Easier process to make upgrades (not having to go back and forth to vendors).
Design centre hours - open later at night."
