TAM0411104,"Sales Centre - Things discussed about our new house were not always properly noted in the paperwork or were forgotten about completely.  Sometimes, we have been told one thing only to have the information change the next time we are at the sales centre discussing our house.  It's can be very confusing.  It makes you feel like you need to write everything down or tape the conversations to make sure you're getting the information correct.  Definitely not enough time to sit and go over the blueprints and not enough information on what to look for on the blueprints.  It's easy to miss things if you don't know what you're looking for or at.
Design Centre:  Choices of standard tiles for the kitchen backsplash are extremely poor.  Notices need to be posted when pricing has changed for upgraded items.  We priced out an upgraded tile that was listed in the binder at a certain price and then found out the next week that the binder price was incorrect and the item had gone up considerably to the point that we could no longer afford it.  It's very disappointing and discouraging.  My wife was near tears a few times when we couldn't find a kitchen backsplash that we liked or that we could afford
However, everyone at the design centre is very nice and very helpful"
TAM0114106,Possibly consider extending evening hours beyond 7:00 p.m. or be open every day of the week until 7:00 p.m.
TAM0612114,"When you chose an upgrade should be reimbursed for the standard option..........greedy not to do otherwise.....Muskoka does it.

Unhappy about the additional cost added to granite purchases.  Should be able to get pricing on different models at Emerald.

Cupboards should be available at Grant's tile so you don't have to carry them back and forth."
TAM07181030,The sales representative did a great job!
TAM0811125,"We loved Deb and Mike, they treated us very well.  I think Tamarack should have a few more model homes for viewing."
TAM0813116,"We did feel at times that, because we were trying to keep our budget low, we didn't always receive as much attention from some of the reps/employees as we would have if we were looking to spend more.  There were a few instances throughout the process where we were a bit blindsided by things that almost made us walk away from working with Tamarack all together but had already invested so much time and it wouldn't be feasible to choose another builder with what little time we had left (we are from out of town and were in town to purchase a house).  We understand that many builders have similar upgrade costs and some of Tamarack's were reasonable (such as upgrading from Oak to Maple flooring) but many were very unreasonable (for example, staggering tile, adding pot lights, etc..)  We are aware that these things take more time, and in some instances more material, but it does not require much, if any, more time/work on the company's end so any overhead costs shouldn't apply, in our opinion. We walked away with the upgrades that were most important to us, but would have been happy to do more and pay more for the house if we felt the costs were appropriate.  Although we know we will be happy with the house, we did feel that the costs of some items were dissuading us from upgrading.
In addition, we found it very difficult to choose our options from such small templates (the 2x4 inch paint swatch, in particular).  This made our process quite lengthy.  If there were larger samples of products, it would be easier and if there was someway to have computer software to be able to see a rough idea of how cupboards/flooring/paint look together - and lighting locations - it would have made the job way easier."
TAM0911100,Perhaps a better process to buy the house instead of standing in line before the houses went for sale.
TAM0712109,"Given we did not have many option because of the City of Ottawa had pre-approved our plans, I would have liked to have made some minor design changes that we were not allowed to do. While I understand why, its still disappointing."
TAM0416102,Structural meeting
TAM1109108,Would have a determined closing date at the time of signing not TBA
TAM10191040,Give more time frame
TAM08191003,More flexible hour and fewer options.
TAM0615105,"A bit more clarity on date ranges - we were uncertain when the actual design process would start, so nervously followed up a couple times."
TAM0511113,more otions and clearer price ranges
TAM08172008,Not much to change
TAM08191042,The design centre should be more open to the need of clients. Software that can help to visualize choices will be helpful at the design centre.
TAM0312113,It would have been better to have more notice prior to the inspection
TAM0715115,"Initial timing presented by Design Centre was not sufficient or consistent with written timelines.  However, this was addressed once feedback was provided through sales and customer service reps"
TAM1118111,"Design Center:  would recommend shorter meeting times with extra appointments.  To have move appointments available on Saturdays.  Some people are not available to leave during the week-days due to work.  It would be great to open Décor Center on the weekend. 

Painting:  Lots for spots, cracks and strikes on wall.  Metal  piece exposed on the ceiling and needs be replaced.  Rush job on the painting all around the house.

Sales Rep:  Needs to be more knowledgeable as we had questions that took along time to receive answers (month or so) and most times with no answer or would tell us to discuss with the décor center who would then direct us to the construction office. 


Frame Walk-through:   We didn't realize what the purpose of the appointment was until we had left as we did not received an explanation. 

We are previous owners of Tamarack homes and purchased through your company again given the great home and service experience received.  Our first home experience was  a lot better from start to finish.  We had repairs completed right away.     Not happy that trades services not working  over the winter as we have issues that we would like to fix.   Example hole in garage that is leaking cold air  into the house that would be nice to have it fixed now.   We have covered the hole with tape etc.  Our heating bill has been affected due to cold entering into our home."
TAM1015129,Too many upgrades that should be standard. Incentive of upgrade should be increased or higher. We would have liked to have a choice of hardwood floors instead of carpets without additional fee on 2nd floor.
TAM0715116,"It would have been nice if the builder would have been more flexible. We understand we bought the home at drywall but all things considered removing things like the prefab so we didn't have to do it after we close would have saved us time later. We really had the master bathroom high up on our priority list but with the added costs of removal of the prefab we were unable to do things before we close. With a baby, it just makes the process that much more difficult after the fact."
TAM1010128,"There was a lot of miscommunication between the kitchen design and design center; a few times they told us it was the other who would take care of certain design aspects.  As well, we emailed the designed numerous changes and they hadn't been changed in the file prior to our visit.  All of the old choices were displayed upon entering the design center instead of the newly emailee choices which easily added 30-40 minutes on the design process.  However, the consultant was extremely patient with us and very knowledgable.  More consultants are definitely needed for this bulk of volume."
TAM0809101,I would have the Pres & Vice Pres & other Top guys to get off their seats and come out & meet us the Buyers.
TAM01181012,Design center shall be more capable of offering alternatives to meet the customer satisfactory
TAM12191018,The lady with the design she needs to be nicer and not rush when figuring things out.  I felt I was taking too much time and she was bored with my time with her.  You might want to switch people around so they are not bored and maybe switch your standard selections up a bit.  Give the designer more ideas to think about and help with the design.
TAM07191044,"The design centre I would provide a coat hanger for people.  Maybe coffee or water dispenser.  The rep had her own coffee.  We never had a chance to look at a model home.  The design centre should have had more samples to choose from.  Maybe 3d model software would help in the design centre to see what the choices would look like rather then jus the samples.  It would make the process quicker.  In Kingston, we had to stop at a completely different to get the safety gear.  Also the safety boots were too big.  They didn't have a size for women and they could have been a tripping hazard.  I managed but they should have something for women.
Communication with the design centre, some communication problems.  Some of the samples weren't there and we had to go to Westborough.  There was a miscommunication with the grout colour.  Also discrepancy with shower tile.  We caught a mistake with colour.  A good idea for the design to emphasize to the customer to make notes to compare with the design centre sheets so that the home owner can double check things like we did and catch mistakes before they happen and get put in the house."
TAM08171006,"Would like to have had a heads up when it was design time instead of being told ""here are the 3 dates"". The fact the consultations need to be during regular business hours also made it difficult as this means taking a number of hours off work. Being open on Saturdays isn't sufficient.

Would recommend design and Muskoka HAVE to be at the same time, back to back. We had conflicting schedule the first time but it got resolved.

Overall, great experience. Kudos to all the staff."
TAM0411109,"Our sales centre experience went very well. 

Our design centre experience was quite negative. As requested during our first appointment, we returned to the design centre and completed our selections on our own time. We spent over 10 hours selecting our choices. We were ready for our second appointment with our designer! She was quite negative to our selections, and was not knowledgible on any of the products we had questions about. 

During one of our visits at the sales centre, our sales person told us we could remove the 'Tamarack' brick from the exterior of our home once we arrived at the design centre stage. Once we arrived at the design centre, our designer told us this was not possible. We had to return to the sales centre, where steps were taken to grant our request.

We would not recommend this designer to anyone!"
TAM0813117,"No, nothing to add."
TAM03182037,"There were issues working with the company Concept Homes.  I did not find they were helpful nor did they respond in a timely fashion in order to complete my selections in time.  

Also after the framing walk-through, it would be nice to get a list of the deficiencies identified and when they were remediated.  I have not see this yet."
TAM08191005,"There was a pricing options, a lot of them did have enough of a price range on them."
TAM0317117,"*More follow ups
*Make sure contactor had most recent updated agreement with full list of updates from either Ottawa office or design centre. Such information should not be provided by client directly and this request will only rise concerns to clients to worry more."
TAM01181010,I wouldn't change anything; the sales and design centre processes were great!
TAM0610121,The design centre is understaffed. The process to choose options felt rushed and was not as enjoyable as it could have been.
TAM0816116,I don't want to change anything.
TAM0211110,"I think maybe the communication between sales centre, and design centre could improve."
TAM0913101,"The sales process was very fluid and linear, however the design centre process could have better communication, especially in terms of having to contact our own sub-contractors for our upgrades in the home."
TAM0110109,"If we could change anything about the sales or design centre it would be, to maybe provide frequent non-generic updates of the construction. 
Also, if a home is on the boarder of becoming an inventory home, the purchaser should/must be made fully aware of that, to avoid limitations to their construction."
TAM1015101,The problem does not lie in the sales or design process.The problem appears to me that it is in the revised architectural plans (as per agreement with the sales & design center). Also it seems that this information is not given to Your subs (from your office) in time therefore framing wrongly and then demo all the work as per agreement plans! this happened to my unit and just can't wait for a walk through. In my opinion there is a break in communication in the framing process.
TAM08181013,"I think the upgrade price quotes process needs to improve.  Not only was my design consultant given incorrect information regarding an upgrade (which caused some unnecessary work on her and my part), but she had to submit price quote requests to head office so I only received the costs for the various tile upgrades, etc.  on my final paperwork.  It would be nice if she could have easier access to quotes and be able to provide it more readily to me so I can make choices BEFORE final paperwork.  I also had to keep checking the design consultant's work on colour sheets, etc. because even though I made a few changes in upgrades along the way, she made several errors which would have cost me money had I not caught the mistake.  Doesn't anyone else check it? 
 In addition, the design consultant could not explain how my design center upgrade bonus was applied with taxes as I could not reconcile to the numbers .  She could only say that the ""spreadsheet"" figures out the taxes with the upgrade bonus.  I had to trust that it was correct.

In addition to the design process, I had asked a question to my customer care representative regarding an inspection prior to drywall going up.  Apparently she gave me completely wrong information by saying that I would get one when design choices are done.  But I later found out from my design consultant that I don't get this walk through because I purchased an inventory home.  I think more care needs to be taken with regard to information being provided to customers."
TAM12191028,Hope the design visits can be combined in as minimum appointments as possible.
TAM01201018,N/A
TAM1111144,"Sales rep needs to be sent on a course on what is standard vs. upgrade. Valarie needs to understand that honesty is the best policy as we discovered many areas where she stretched the truth to give us the feeling that our needs were being addressed
ie: 4 car driveway. We asked this questions on at least 3 occasions and were always informed that the driveway can hold 4 cars, once construction began, it was clear the only way for the driveway to allow 4 cars parked would be if they were all Smart Cars. 
Both my wife an I were disappointed with this and a few other areas. I have been been in sales for 10+ years and have never once misled a client to get the result I wanted. We would have preferred to have 'gee I'm not sure, but let me jot that down and get back to you once I have the answer'"
TAM0413106,"Explain that the total quoted price does not yet include upgrades and other additional accesories such as dehumidifier, electronic/automatic garage door openers, etc.  especially for those who are buying a house in Canada for the very first time.  

This is because some houses sold in US come with appliances, so the expectations are different depending on previous experience(s)."
TAM10181035,"To be honest, the entire process was thorough and excellent."
TAM0515108,I wouldn't change anything.
TAM0715122,"We were a little bit surprised that we had to pay for some things that we wanted removed from the standard design (instead of getting credit for them) and still pay extra for some things that required much less material than the original design. Also we think that it is not fair that Tamarack charges $500 for ""drywall repair"" per floor (in the inventory home) when we requested pot-lights and TV conduit relocation above the fireplace. At this stage the house still is not finished and it's not like Tamarack had to re-do/fix anything."
TAM0214103,Nothing - every aspect of the experience was exceptional. Your company has a great team of associates in Orleans.
TAM12191022,The communication on setting up appointments were lacking - I needed to reach out to them instead of the other way around.
TAM0910114,"I would completely change the subcontractor you use for entertainment services.  We had significant difficulty in getting them to accurately depict what we wanted, and then they were completely unresponsive when we were trying to get them to correct it.  In fact, in our walkthrough, we found after having tried to get ahold of them for 2 months, that it was done incorrectly and had to get the vice-president of Tamarack involved in the resolution.  I would NEVER use Concept again."
TAM1015121,N/A
TAM10181030,"It would be better if more tech tools are involved for idea demonstration, for example, with AutoCAD. Often times, I had difficulties to visualize the design ideas."
TAM0812120,"""Blue prints for new home models with walk-out, to include mechanical location, need to be available to reduce speculation of furnace locations and ducting.
Both sales and design centre would benefit from computer generated displays of available options.  This would reduce guessing/anxiety by providing immediate graphic representation of selections.  These programs are readily available.
Walk through inspection with site boss could be more collaborative vice confrontational.  Client observations are concerns not criticisms."""
TAM0214106,"Knowing that we are limited to certain suppliers when selecting plumbing upgrades would have been nice. We feel that we were mislead on what our options were during the sales process. We were given the impression that all we had to do was provide the make/model info and we could have any _____(sink, taps, flooring etc) we liked for our home."
TAM1109101,"Please standardize and make the colour scheme denoting the level of an upgrade consistent for all products (i.e. floor tile, hardwood flooring, carpet).  The current scheme is very confusing (yellow-green, blue-red for carpet or blue, green, red for floor tile...).  Just pick one grading scheme for all products."
TAM1014117,"everythings was wonderful nothing to change Louise, Darlene and Kim made the experience of buying our 2nd tamarack both enjoyable and easy!!!"
TAM08191054,Please give me VIP on your next new development.
TAM1118117,Include list of dates of when the different processes will take place when signing the sales agreement. Processes such as estimated dates for design centre or frame walk through so that buyers can plan around those times.
TAM0711135,We purchased a model home therefore we didn't visit the design center.  Our inspection is scheduled for June 9th so some questions are not valid at this time.
TAM0713123,"First off, this survey does not fully reflect my experience. We had no design centre dealings at all. There should be a 'not applicable' choice.

The house we bought was listed with a realtor, through whom we 'bought' first. It had a sign in front of the house, was in their roster of listed houses. The sales person criticizes us during our officially sale meeting that we should have gone directly to the sales centre instead of going through the realtor. This was very conflicting for me and didn't sit well. Had the sign been a Tamarack sign, I would have gone to the sales centre. Why would I even think to go to the Tamarack sales centre if a house has a realtor's sign on the front lawn?!"
TAM1110123,There was no model of the home we chose.  As such many errors were made in design option we chose.  Fortunately they were corrected.
TAM0514103,"The staff was very friendly and helpful. However,one of the issues we had was that we were led to believe that the stainless steel appliances included were going to be high end quality which they are not. The other issue that came up was when we went to make electrical and plumping changes we were told our house was already dry walled and we would be charged extra. In the end our sales person and design center person went to bat for us and we weren't charged. I think there needs to be better communication within the Tamarack family so customers don't encounter these types of issues."
TAM02191016,"Sales rep, décor and office staff was great!   

Extremely disappointed with the construction rep (located at the site trailer) Mike.   He is an extremely rude person with absolutely NO respect, he is rude, loud and arrogant.   When we arrived they did not have my shoe size for the frame inspection, he didn't care and was totally rude. He was so rude to us that lost all interest to even participate  .... we just wanted to get out h*ll of there. 
We returned for our PDI and arrived on the wrong date,  Mike was extremely rude to us again however, did have the nice lady Wendy do the walk through with us.   Hard hat, safety glass and shoes are disgustingly dirty.
  Wendy is a very nice lady and professional.   Mike is giving your company a bad reputation.  Our family purchased 3 homes from Tamarack and this will be our last. I will never purchase a home because of the experience with Mike.  You need to replace him."
TAM1016110,"The layout of the design centre is less than ideal.  The standard (spec) choices are limited and in some cases, disappointing (for example cupboard hardware, stair rails, paint colours and bathroom fixtures to name a few).  There are too many upgrade levels and it's impossible to determine their cost during the active selection process.  It makes one cautious when making choices because you don't want to escalate your purchase price by $100K with a series of choices.  There was also nickel and diming on ""upgrades"" (for example grout colours cost extra).  However, we want to emphasize that all staff we met at the Sales Centre, the Design Centre and the Frame Inspection were excellent - cordial, courteous and professional."
TAM10191001,"Reponses or prompt responses from the sales team would be appreciated.  More time in the design centre, felt very rushed at the end.  Also I would prefer to pick my own tiles, etc from all the choices rather than have the designer choose just a few to show men and have to keep sending her back to try and find something. Also once I went back and looked at all the tiles myself, I saw something I really liked that I hadn't expected to like. My tastes or vision are not necessarily those of someone else."
TAM0614201,Cannot really think of something right now:)
TAM06181000,To be able to buy material ourselves as some pricing are just overwhelming
TAM1015108,"Software program for design centre so when choosing upgrades, the cost is automatically calculated (barring the custom pricing which requires a quote). Also if there was a visual, so if you chose a counter with cupboards, you could actually see exactly what it looks like.  Hard to put it all together when it's small samples. With technology I'm sure there is a program out there that Tamarack could tap into. Also, the design centre representative had an overdose amount of perfume on each and every time I went in and this made me feel sick. On the last appointment with her, I advised her of such. Afterwards she treated me with disrespect and made the remainder of our appointment unbearable. Furthermore she gossiped about it to the sales centre staff and I've been treated differently by them since that time. I understand that I had many upgrades, and quite a few changes throughout the process before I finally signed. I spent @ $50K in upgrades so it was a difficult process, which made it more challenging by the fact that I didn't get pricing on items in a timely manner, so changes had to be made later. Everything is fantastic now with the builder and construction crew. I was blown away with how fantastic Charlie was on inspection. He was extremely professional, and he appeared genuinely concerned with the process. He took the time to explain what will come next as well."
TAM1111129,Have the same selection of Standard Hardwood for Half Moon Bay as the other developments.
TAM0511124,"I found Tamarack to be completely inflexible on upgrades that I wanted because I purchased an inventory home. It was a complete money grab to charge me $500 per floor to install potlights! 

I had no say in where the cable/internet was placed. Also, I wanted to lower the half wall in the kitchen and again the answer was NO with no consideration for what the customer wanted .. and I was wiling to pay for the change!!!  You would not use my Benjamin Moore colour when I was willing to pay for the paint upgrade... and you were charging me an ridiculous price to paint but not improve the quality of paint.  Again completely inflexible in the paint colour.  Cleary design and decor are not a priority with Tamerack.

Howerver I did find Mandy Mason and Ewa to be outstanding.  Some of the best service I have recieved by any home builder.  They were both very helpful and professional."
