TAM07181043,"Nothing, I am always greeted with a smile. The staff will accommodate my needs as I am from Kitchener. Long distance means I can only be at the house during certain times. The reason why the house wasn't cleaned up when I visited for the Frame inspection is because again, they accommodated me in allowing me to do the check before it was completely done. The site supervisor was excellent and very knowledgeable. There was no construction going on at the time of the visit therefore I didn't see a need for the safety equipment during the visit, offered or not!  Overall, great service, excellent knowledge and professional staff. Excellent company with reputable trades."
TAM10181042,"Sales- They need to be transparent and clear on the timeline and options. We were not provided ample time to select our exterior. I was showed a brick color and when i asked if it would look like the house there the rep said yes. However, when we saw our house the bricks didn't match for what we selected and were told. We paid extra few thousand dollars for extending the cedar deck and we got pressure treated wood deck as they said that from 2018 the only build pressure treated wood deck. If a customer pays for gold and gets silver for that amount, I am sorry to say it is called FRAUD. The sad part is we were not even informed that they build a pressure treated deck.

Design- Reps are  not up to mark,very poor knowledge of the designing. We were not offered a lot of upgrade options. When we asked for quote for upgrade they made it difficult. After numerous emails and clarifications we still had a lot of mistakes. Wrong upgrades were done.  I would highly recommend that Tamarack replaces the employee or train them. I am sorry to say but people will go to other builders. Buying a new house is a happy moment but we were and are still stressed. It takes a lot of ours and Tamarack's  time to get everything sorted out and corrected."
TAM0311123,"Nothing, went very well."
TAM0312105,- DO NOT OVERCHARGE FOR SO CALLED 'UPGRADES' THAT ARE NO DIFFERENT IN PRICE THAN THE STANDARD IF YOU COMPARE PRICES AT SUPPLIERS; YOUR COMPANY JUST PICKS THE UGLIEST AND POOREST STANDARDS TO FORCE CLIENTS TO PAY EXCESSIVE AMOUNTS FOR UPGRADES (THAT ARE RE
TAM03191013,"The selection of hard wood at the design centre located in the building all need to be included in the choice for home buyers.  We were informed to not even consider looking at one wall since this was for other homes not ours. Also, Muskoka provided us with a layout of the design of our kitchen on paper.  This was helpful, however with technology it would be great to have a virtual design of what our kitchen would like to have a better review in order to accommodate any changes.  This was the largest upgrade to the home."
TAM1010101,Have more of the exterior colour samples on site.
TAM0815112,It would be helpful to receive a better understanding of the backyard landscape.  We paid for a premium lot with trees to create privacy and it's not as of now what we expected and understood.
TAM0414119,It would be nice if they opened earlier in the day. Otherwise we enjoyed our experience very nice people.
TAM0316101,n/a
TAM01181015,Everything was perfect on time and professional
TAM04182001,"Nothing, they are super."
TAM0711132,Ensure that prospective buyers are aware that bonus dollars advertised are tax included which means less value than expected at the deign centre. Perhaps a reduced bonus or a bonus that does not include tax would be more up front and therefore not a surprise disappointment when revealed.
TAM09191006,"The sales centre is fine but design centre  is a sales trap. The standard products offered are outdated to force you into upgrades that are priced at many times 
 over the real and fair market value."
TAM0815113,"Design centre process felt rushed to make decisions.  Also, it would have been nice to have running totals of projected costs for options selected.  The first time seeing total costs for upgrades is very close in time and date to signing off on things.  It would have been a lot better to have running totals at each visit, because to change one thing could have a cascading effect and could impact various other decisions.  It was made clear that there was limited design centre time, and more time would not be provided if you were going to start making  significant changes near the end.  We felt we had no idea what the total costs were, and then it was impractical to try to make changes that we would like and could be sure would not impact other choices."
TAM0812119,"It would be helpful if you could conduct a pre-selection of interior materials and upgrades virtually - either on-line or at a terminal in the design centre.  Via digital imagery, clients could experiment with different options in a simulated room.  In this manner, colours, textures and materials could be compared - giving the clients a better feel for what works.  The total price could also be tallied as they select options.  After selecting the various options, they could meet with a representative to discuss and confirm their choices.  This could serve to help clients make more informed decisions.  It would also reduce the amount of time a representative would need to spend with each client."
TAM0510119,"Ever since I first stepped into the Model Home Sale Centre, everything has gone fantastically smooth.  I would change absolutely nothing about the process."
TAM04191019,Décor Center Receptionist was horrible and awful.  She rushed out and provided wrong information about upgrades.  I was fortunate to have a family member attend the appointment with me that was knowledgeable about the upgrades.    Sales consultant was great!
TAM12191021,"We had a terrible and stressful design centre experience. We were confined to very limited appointments and were rushed to make choices. The number of appointments and the availability of design consultant should be based on buyer's needs and budget. The pricing for custom choices should be available at the design centre without going back and forth to the head office.

Design Centre Issues - Our design consultant came least prepared during our first meeting, totally unaware of our structural upgrades. It seemed to us that she came with a pre-conceived notion that all our choices will be made during the first meeting itself. We were rushed and felt very overwhelmed after that appointment and yet we were told that we only have one final meeting left. Not all buyers stick to basic options or rely on design centre bonus to make upgrades. The process would be more effective and efficient if we had got additional time with the designer rather than having all the communications through email. We had to correct multiple times on the selections we made as she kept missing them in her email updates. During the frame walk-through we found out that the site crew did not even have the updated/final design selections.

Custom Pricing Issues - Many custom prices provided to us did not make sense. We had to go back multiple times to correct their mistakes and quotes. An online tool would be really helpful.

Building Issues - The site crew missed an additional window (upgrade) in the basement, even when it was clearly documented in the blueprint. They had to cut open the concrete to add the window after we reported this to them. The ultimate shock was when we came to know that they mixed up the Ensuite and Laundry room windows. Just 2 weeks before the closing, they had to rip open everything and replace the windows.

We are crossing fingers and hope that we will have very few issues to go through during PDI and stress-free closing."
TAM0910117,"There are no major changes to be made I was very pleased with the sales rep I had, Noella Francoeur, she was very informed on the Tamarak product and accepted to do the walk through on the property inspection when I could not be there (reason I did not respond to those questions).  At the design centre I had the great fortune of working with Christine Marsala who is a wiz when it comes to making color and material choices, and innovative choices, within a very short window of appointment time.  Sheri Sinclair, another efficient design centre worker quick turn around on resolving  admin issues.  Overall great job from everyone, maybe some extra staff at the design centre for peak periods and more experienced staff like Noella in sales.  Other than that.....
Bravo Zulu Tamarack!!"
TAM03191008,design centre could have an online portal to create a 3D virtual image of selections inside the specific housing floor plan
TAM09191012,Nothing.
TAM1115110,"I know that it may be a detail for you but the standard choice of grout is not a very nice color that doesn't match with most of the tiles. Also the cost of 200$ to upgrade the grout is not acceptable. I was bothered with this situation because this company offers so many beautiful options for everything (tiles,floors, carpet, counters, ....but just 1 color of grout). I do not understand.  I wish that you would reconsider this. Thank you!"
TAM0413110,Nothing.
TAM1012129,"Sales rep need to be kind before and after the customer buy a house, and be understanding with the client"
TAM0712115,"I understand that within 90 days of the original closing date, you can receive a notice of a delay in the closing. It might be worth considering sending the homebuyer a short message even if there will be no delay in closing.... It is always nice to have a positive notification rather than waiting to see if you will be getting a letter or not.

Thanks"
TAM1116100,other than the issue with the frame check / late design centre appointments our experience with tamarack has been great.
TAM04171024,Not to have to go back to the design Center to repeatedly  sign paperwork  that should have been completed  correctly  the first time.
TAM1112127,"The Sales Centre Representatives are great.  The site supervisor and his coordinator (I think it is Christine) are great.  The design centre representatives are not so great, in comparison to every one else.  And that was disappointing."
TAM01191007,"Nothing.  I have been 100% satisfied with the process so far. 
They have been very accommodating to me.  I showed up a day early for my frame check in apt and instead of sending me home, they made the time for me to go through the house. 
The design center ladies are always very friendly and helpful and I trust their expertise to make sure I have chosen ""nice"" things for my new home.  
Thank you for remaining a quality builder!"
TAM0413113,More room would be nice in the design centre. There could be more on display and a broader selection of upgrade options
TAM01201012,"Nothing, its been great."
TAM0112109,Process was good...people were polite and knew there stuff....not like monarch
TAM1115118,Everything was fine but we were n told that the telephone jacks could be used as internet connection that was what we were told (?). I don't think homeowners should buy a house without eavesthoughs.
TAM05191019,N/A
TAM0716106,See proposal on Walk-through question
TAM06181016,An obvious omission during the sales process is the lack of explanation of the water tank rental agreement. This could been explained in more detail.
TAM0816101,More bathroom options for layout.
TAM07181046,nothing- everything was perfect.
TAM0613101,"Hours of operation, longer evening hours."
TAM07191004,"The Sales centre has been great - very informed - and our Sales prime , Noella, has been extremely helpful in all matters and concerns.

WRT the Design centre, responses to emails and phone messages were not always forthcoming.  It appears that add'l staff to handle the heavy load would be helpful."
TAM1212117,Ensuring the pricing in the catalogue for the extras are accurate. The catalogues are specific to each model home therfore the pricing should be accurate for any changes. Buyers do not like suprises when it comes to pricing changes regardless of the amount.
TAM0815117,"Design centre - choosing upgrades is very complicated and it should be a simplified one step process not several steps for example to choose the item for example kitchen cabinets, then red green yellow dots and related upgrade costs and finally choose the item colour. The price for choosing colour is separate.  Same thing choosing a carpet, color code dots etc."
TAM1213111,it would be good to have a better range in the operating hours.
TAM0312103,"Our sales center experience was fantastic ...everyone from Sal to Darlean were extremely welcoming and helpful. Our design center experience on the other hand felt a little more cold. It felt extermy rushed. We are first time home buyer so this process of what to choose and what not to choose is completely new to us, so after the signing off of our upgrades they're we're a lot of things that were brough to our attention by friends that I felt should of been mentioned by or design rep. No suggestions were offered to us by her at all, and again the entire process felt uncomfortable. Another point that really annoyed me about the design center is that it is IMPOSSIBLE to get a hold of someone there ... They never answer the phones."
TAM0511118,Outside contractors like those for home entertainment felt like an obstacle.  Options should have been available like all other upgrades.
TAM03191004,"No safety was provided.  The inspector did have his hard hat on and we did inquire about the safety gear but said it was not needed.  

Sales: Would have been nice to know that our exterior décor example color of brick/door color and garage.  We assumed it would have been the same exterior colors as the model home.  To our surprise our brink was fire red and not the nice grey.  

Décor Center:  with todays technology the center should be able to provide a digital picture of the color selection.  Example:  how the kitchen would look with the cabinets counter tops and flooring. selection.   It is hard to envision if colors selected would be nice together."
TAM0313104,All in all the service is pretty good.
TAM0510143,"I believe this is actually happening as we speak, but in Kingston you have to drive around to different suppliers to pick out flooring, cabinets, countertops etc. It makes the process very time consuming and frustrating. They need to have their own design center like they have in Ottawa."
TAM0912119,"Found at times when we sitting going through things with the designer that people were coming and going --- distracting.
Room to dark."
TAM0611103,"EVERYTHING!!!!

Nothing is customer focused - not even this questionnaire (data gathering - period!). 
There is no attention to detail in the documentation process. Hopefully your building process pays more attention to detail than your administrative process.
There is no communication between Kingston and Ottawa - as witnessed by the random email we got from our representative Terry and the incorrect email address used in the letter we received from Christopher Taggart (attention to detail!). 
Documentation is abnormally slow to be received via the pony express once a week from Ottawa - email, scanners, faxes, 2011..... anyone?
Your staff are unable to clearly communicate 'standard' vs. 'upgrade' or to provide pricing on anything prior to purchase - ridiculous. 
The process, is bizarrely slow (for a company in the business of selling houses), laborious and has been a drain or our time, our realtor's time and our lawyer's time. 
Your 'design centre' staff are unhelpful, self important and unavailable to answer questions. 
Your staff are unable to react to anything (i.e. mistakes in documentation)without going via Ottawa - who take a week (at least) to respond to anything. 
Your documentation is out of date, but no one appears to be interested in updating it (HST was introduced a while back!). 
Everything is focused on Tamarack getting what it requires, but not on the customer having their needs met. (Taking two weeks to put TWO signatures on a 9 page agreement - not signing all the places it says Tamarack should sign and calling it 'standard business practice'). 
Whoever is advising you on customer service, marketing and sales is doing a VERY VERY poor job. I've been advising blue chip clients in this area for years and to even use the term 'customer service' here quite frankly is embarrassing.
We get much better (and more courteous) service from our car dealer and our cars cost a fraction of what this home costs. 
Your staff in Kingston, are uninformed, arrogant and seem to have no understanding that a purchase of this cost requires and in fact demands a high level of customer service, basic manners and etiquette. As I've already mentioned, I get better service for items that cost a fraction of what this home costs. 

You are in the fortunate position of owning a company that is able to make the buying and design process smooth, fun, easy and hassle free for your customers, yet you choose to make it hard, frustrating and mind-numbingly painful. I can only wonder at the number of customers you have lost by handling business this way. 

By the way, don't 'thank me' by offering me $500 so you can earn $350,000+ from the sale of a new home. That helps you more than it benefits me. If you really want to say thank you, then do something that only benefits the customer. That is what a true 'thank you' really is. If you want to introduce me to your referral programme that's fine, but don't hide it behind a 'thank you' - it's insulting to customers that have brains and actually are marketing savvy. 

We were led to believe that Tamarack homes had a high level of service and excellence - boy were we wrong. 

Quite frankly the whole process has been a huge disappointment and we are wondering if we just made a 400K big mistake. I guess we will only know when the house is complete. 
We were using this as a test market, because our main family home is in Ottawa and we were considering buying a Tamarack there too if this went well. I can assure you, we will not be buying another Tamarack home and we will not be recommending the company to anyone else. 

Please ensure these comments get passed to Christopher Taggart, he should know how frustrated and let down his customers feel."
TAM12181008,More transparency and communication during the build process.
TAM0715103,"Having to wait and stand in lines to make the purchase when both we, and the sales staff, knew we had been waiting for the release for well over a year and were going to move forward doesn't seem to make a whole lot of sense??  I really don't understand the advantage to either Tamarack or us when a guaranteed sale is there!!"
TAM06171004,"The sales part had an issue with our home being a ""reverse"" plan; it caused issues for both us and the sales agent in getting requirements properly assigned - it caused frustration on our side and required previous email traffic to be provided to prove our requirements!  Having a set of reverse plans for each home at the sales office should be standard practice as I am sure that all models are being built in both standard and reverse layouts.  The design centre personnel were professional and helpful; however, the design centre was in the throws of being moved and the presentation and availability of design parameters was limited or not fully functional for many of our visits."
TAM02191008,Notiong
TAM0810118,Having more time for the second appointment.  Getting quotes back faster.
TAM0717123,Having more information given to prospect. I went to all of your Sale center the one that did an outstanding job was the one in Kanata. They make us feel like family. The personal touch in sending a handwritten card made us feel like we weren't just a number or just a prospect in your data base. Because of that I put my offer in Kanata but my fiance like Barrhaven better so we settle there. If you do want to conduct sale training I will suggest you use your team in Kanata as an example of professionalism.
TAM0112108,"Would have beeen nice to have a design centre in the Greendpark subdivision. 
The kitchen design was a major part of customizing our home. Even though the staff here in Kingston did a great job helping out, I would have liked to have met a rep from Muskoka Cabinets here in Kingston to discuss design possibilities. I did not have time to go to Ottawa and ended up doing everything via telephone and email. Even though the job got done, the process was at times frustrating. 
All for now, thank-you for your excellent service."
TAM0115100,"We were told that if we completed the design centre quickly that we could have a bumped up move in date (my wife is pregnant so it was important for us to do this). It took weeks and numerous follow up phones calls to Deb Champagne for this to happen. Although I am satisfied with the new move in date, I wish this process would he been smoother."
TAM01181006,"Great experience, Morgan was great and went out of her way to provide samples of some tiles I liked at the tile store to show them in person with the other choices I made."
TAM1014122,I think this process is very effective and well organized. Team were excellent
TAM0412121,I want to move in asap :)
TAM0614221,we did not do the design center
TAM12191010,Design center seems hard to understand and navigate if you go on your own and everyone is busy. I like tamarack for the quality but mattamy had a more user friendly design centet.
TAM0910103,Everything went smoothly and everyone I was in contact with were helpful and pleasant to deal with.  Overall a great experience.
TAM0414102,Nothing really. We had a wonderful experience from start to finish. The ladies at the sales center/showhome in Orleans were always very friendly & knowledgeable. We are satisfied so far with our experience and hope to have the same service from start to finish!
TAM0515103,"Frame Check:  we were given 3 days notice for us to complete a frame check.   We were sent an email on a Monday, late afternoon and expected to drop our shifts or clear our schedule to complete by the Thursday.  we were departing for an out of country trip on the Wednesday morning.  When we advised we couldn't accommodate we were advised that unless we could do it Tuesday, we would not be able to do a frame check as the drywall would be completed before we came back the following week.   This was stressful and completely unnecessary.   A bit more planning and notice from Tamarack would have made the first experience in our new home much more pleasant, rather than the stressful schedule bending we had to do to fit it in before our trip. I would expect that we will have much more notice for our pre delivery inspection."
TAM08171005,Very satisfied and everyone is very professional
TAM0913118,not a thing
TAM05191005,"It was great to see all the samples under one location. Design center should have bilingual employees or should adapt their speaking when asked to. Employees should be equipped with tablet to accelerate the product selection which would allow more time to design select: it took way to much time for the designer to write down all the selected product; this is not a good time employment for such an expert. The catalogue is great, it should be in PDF form to allow searching in the document instead of a PDF image. There could be links to images to show the product in the design center to facilitate the buyer selection of the product thus facilitating being ready for the appointments with the designers. This would save time to the buyers and to the designers."
TAM0713102,"Have a Tamarack representative be the middle person between the client and stakeholers (concept home, fireplace, ceramic...)."
TAM0712101,"The initial girl who showed us around, didn't seem to know much. Couldn't answer barely any of our questions on how things would work.. It wasn't until our appointment with the designer that we understood everything"
TAM0510129,The sales centre is find.  The salespersons are helpful.  The design center is another story.  The prices of all upgrades should be clear and we shouldn't have to go and shop for certain items and wait for quotes. There is a lack of communication between sales centre and design centre. There is also a lack of communication between sales centre and site manger.  We are currently having problems with the relocation of 2 ceiling lights.  We inform the site manager of this problem as well of the salesperson but they don't want to do anything about it.  We have been fighting for a week now and once the ceilings are sprayed it would be impossible to fix it.  They were made aware of this before the ceiling was put on and didn't want to make changes.  The location of the dining room ceiling light fixture will mean that our dining room table will be sitting in the middle of the hallway!  Also the entrance ceiling light fixture is almost near the wall!  We also feel that the front door opens on the wrong side but the blue print is misleading and they don't want to change the opening saying that it is part of the structure.  This means that we will not be able to put a small bench in the entrance because the door opens that way.  We are very very frustrated.
TAM0413116,To be more informed about all my options before buying.  The sales person was not educated to the different models
TAM03171000,"Nothing to change other than please hire me to work in your sales center.  

Thanks, 
Genevieve Allen"
TAM11191028,A bit confusing and overwhelming. Some of the quoted prices for upgrades during the sales process were quite off from the realty when choosing upgrades. May suggest showing potential buyers what the standard options are prior to the sale.
TAM10191000,Everything about the process was to our liking.  Excellent customer service!
TAM0511126,to be more flexible for the outside and inside floor plans
