Source ID,If you could change anything about the sales or design centre process  what would it be?
TAM09191035,The location was inconvenient.
TAM1015109,"The time for delivery.  I know you gave 10,0000 bonus at the design centre,  great Job, but next time if you add the appliances too will beperfect ??."
TAM0911126,"Extra bedroom in first floor ,finished carage with shelves and closed kitchen"
TAM02201002,"We have mixed reviews for the builder. On the one hand, we were very disappointed with the inflexibility of construction. We did not have the option to choose the specific lot with the specific model we wanted - that made it very difficult as there was a specific lot I was after which did not have the model I wanted. We have purchased from a competing builder and they were very flexible with this kind of thing - that was our reference point. The thing that bothered us the most though was they were unwilling to add a bathroom in the basement (or even a rough-in) when that is a standard that all builders we spoke to offer. On the other hand, we were exceptionally grateful when, after we were informed that the closing was delayed, we were allowed to make changes at the design center. We understand that the builder did not have to accept our changes, but did so anyway and we really appreciated that.  So while the staff and the process was great, the inflexibility (particularly with the rough-in bathroom) was what we did not like. I am also wondering why we were not called for a Frame Check Walk-Through."
TAM0510103,"I would not subject anyone to Henrietta at the Design Center.  We found her to be difficult with regard to communication, rude and unable to fatham that we required technical explanation for some of the details she was attempting to explain.  The experience with Henrietta was not pleasant.  Kim Knuth, on the other hand, was wonderful."
TAM1012119,When the salesman was asked questions they would get defensive.  I asked about cracked basements and they got defensive.
TAM1012102,Everything has been great. If something went wrong we greatly appreciated staff going above and beyond to rectify it. We had the tile we picked for our main floor become discontinued...we went in and picked out another plus a different backsplash as it no longer matched the new tile. Staff were able to allow us an upgraded tile as we could not find another we liked in the standard selection.
TAM02201003,Get the house in time ( no delays)
TAM0516111,Tamarack staff were exceptional! Muskoka representative came across stressed.
TAM0310113,"Our overall experience with Tamarack has been good, but the unavailability of appointments at the design centre has caused a delay in our house construction and has been a source of major disappointment for us. We have had to wait 4-6 weeks for each appointment and even then we had one appointment rescheduled on multiple occasions by Tamarack. Although our designer was extremely professional, helpful and knowledgeable, she appeared exhausted and we found the whole design process very disorganized compared to other builders such as Urbandale and Minto. This has affected our closing date (we have not had a framing inspection and we could not complete certain parts of this survey) and has caused us to question if we would recommend Tamarack to our friends and family. We would highly recommend that you hire another design consultant during busy periods."
TAM0112111,"Too many options at the design centre...why can't the tiny options bundled together or included in the purchase price ?

The sales person from Stittsville sales center, Valerie, is awsome. Because of her I ended up owning a Tamarack home. 

I visited other sals centres as well, but they were not friendly with me at all."
TAM08181051,No comments.
TAM0815115,allow more time at the design centre
TAM0816133,"Everything was perfect, very well organized"
TAM0515104,"Sales: We would appreciate if the agent that recommended to us Tamarack Cardinal Creek was recognized by your company. He is with Remax, Greg Hamre. Thank you.
Design centre: It was often hard to get a staff member on the line and sometimes, it is better to explain ourselves over the phone. 
Other than that, super!"
TAM0312114,nothing at all. So far it's been great.
TAM09171025,I would give the option to buyers to put a rough in washroom as standard in basement. But overall Jaqui is a amazing sales person and great to have in any company and Tamarack is Lucky to have her and good for the buyers too she is very helpful.
TAM0815121,"better show room, mark-up way to i for the up grade, don't appreciate to pay twice some material already paid in purchase price
more UN-satisfaction to be submitted soon"
TAM0614111,"Worked with Louise and she was fantastic! She was able to accommodate us before Christmas she was flexible and available almost like part of our family.
PART 3    was answered 5(could not skip that part) because they bought a model home N/A"
TAM0911127,Obnoxiously high costs and markup on upgrades on simple things like plumbing and potlights.
TAM0210110,More time during the review and selection process would have been nice.
TAM1118108,"Sales Centre:  would be nice to have a sales rep accompany customer into the model homes to explain what are standard, upgrades and able to ask questions on the spot.   It is overwhelming to remember all questions when returning to the sales office. 

Design Center: More affordable items for upgrades,  nice upgraded are too expensive.

Home: hired a home inspector who flagged life threating issues in the home.  1.)  Door from garage to home wouldn't close shut. Causing concern that carbon monoxide would leak into the house due to car parked in the garage. 2.) gas pipe in the back yard was too short (was below the deck , not above the deck and was from the door as the other surrounding homes).  Gas Pipe was too close to the patio door and was advised to not open the door until the pipe fitted to proper size as gas may leak into the house.  Was unable to open the window and doors until this issue was resolved.    
The above wouldn't have been detected without spending $400-$500 for home inspection and attention to these dangerous issues should be properly inspected prior to possession of home.    They still have small deficiencies that are pending. 


Note for CEO:  prices to hang TV over the fireplace was too expensive ($500)  plus wiring and only cost a under $200 to do afterwards.   Little consideration to buyer with pricing would be appreciated as we are spending a lot to purchase a home.   Would have liked a second sink in the second washroom but wanted a lot of money to add the second sink. 
Overall, very happy."
TAM0213117,"upgrades are overpriced, and feel some items eg. crown moulding should be standard."
TAM06191014,NOTHING
TAM0414113,"Be able to offer some to the things that tamarack wouldn't do- cover back porch, stone number, pot lights on exterior second level, picket doors"
TAM02182007,"1. Make separate show home without any upgrades, which has only standard feature, easy to identify how home will look like.
2. At design Center, not lot of options in standard feature, need to add more, mostly in cabinet.
3. Home owner should give entry to home, one time in a month before 3 months of closing, to see progress."
TAM07191000,* There was a limited selection of bathroom and kitchen plumbing fixtures.  Would like to see far more options available.
TAM10171037,"1. Instructions on survey not to hit ""previous button"" here since you lose all your comments and have to do it over!!
2. The capability of your sales team other than Jackie! SO I gave low scores in the first survey section.
The general feel the sales resources give is one of being bothered by clients coming in to the model homes and at times were even eating and so you feel like you are intruding on them. Their typical answer to almost any question was ""I will have to get Jackie to answer that"". You almost lost us initially, but we knew you were good so we came back 2 or 3 times...and then that magical day we got to talk to Jackie...and we did the deal then and there! Jackie is your STAR and she represents TAMARACK as it should be and she knows all the details. Once we bought the house, we brought friends in to see the model since they are looking too...and the typical sales force was there and our friends felt such a negative attitude they left and think we are nuts to buy from TAMARCK with such disrespectful sales force....they did not get to meet Jackie...we may bring them back some other time.
My impression is that there is lots of time when hosting a model home to be studying the product, options, packages, etc... and they should know everything they can about what they are selling..... and maybe you should test them biweekly and give them prizes or gift cards for improving their skills...they do not seem motivated to learn more...and we have been talking to them for 8 months now...Last weekend I even had to tell them that the AC unit in the basement of the model home was creating a pool of water on the basement floor....there were no clients in the home at the time but they did not even check...
I know this will make your sales resources upset, but as a senior leader in INVISTA, I think you need to know the truth or you can not change things and I am a pretty credible resource for this, with no reason other than to try and help you succeed. I think you are an excellent builder. And I have been upfront and honest with Jackie, Carolyn, Mike, Steve and Pierre. I look forward to moving in to our new house!"
TAM0911105,"it will be good if we had more time in design center, we felt we run out of time. we had excellent time but people working there were very busy it seems their plate were full. thanks for asking yonas"
TAM0915112,"I would have appreciated having a better package of documents advising us of our upgrade choices in advance of our meeting with the design consultant.  A friend showed me their ""upgrade book"" from Mattamy which came with pictures and detailed explanations of each upgrade. It saves time at the design appointment and helps the customer to be better informed. I probably would have gone with more upgrades if I had a picture of what the ""standard"" looked like."
TAM0615109,"We wish it was made more clear that we had the option to choose a security system from concept rather than having to buy a security system from Alliance.  We do not regret going with Alliance for security, but the options were not clear until I spoke with the rep from Concept after already committing to a security system with Alliance.

Harding representative did not provide me the information I requested regarding the ERV upgrade.  My e-mail went unanswered.  We decided not to go ahead with the upgrade due to the lack of willingness to provide information by Harding.  It would have been good if the upgrades list contained a bit more details regarding upgrades like this such as the model of the ERV being offered and what was meant by ""Ultima Control"".

Tank less water heater rental through Cricket Energy requires signing a contract for 10 years without having much details regarding how to terminate the contract or what it would cost to buy the water heater outright from them after 1, 2, or 3 years of renting.  Direct Energy provided that information outright when we rented our current water heater.   We are awaiting a representative from Cricket energy to contact us to get some clarifications prior to signing any such long term contracts.

Aside from the above, we would change nothing else.  We were impressed particularly with the help we got from Kim Knuth.  She was very helpful to us during the design center process and both of us felt she took our taste and liking into consideration and helped us make the best selections for us.  As the current owners of a new build from another builder, we can't help but compare the design center experience which was night and day thanks to Kim."
TAM05191027,"Wish we had bought sooner so all the options would have been available. Otherwise, very satisfied so far."
TAM0310120,More time for the design centre process. I felt rushed.
TAM07181001,Everything would be less expensive!
TAM08171009,Introduce a design software that could let clients have a better idea of the design of their home
TAM1116119,"Subcontractor Concept Homes wasn't easy to deal with. We had simple questions regarding installation of central vac, potlights, and a conduit and they didn't get back to us for days for an appointment. They also have terrible hours of operation and don't give clients much choice. In the end we didn't end up getting anything with them because of their lack of service."
TAM0211115,"During the sales process, if there is an available options list (those options only available during the sales process) that would be great. Due to lacking of information, we missed a few options during the sales process and when we found out it was too late. For example front door upgrade, garage door upgrade etc. And also some information provided are not accurate. I was asking if I could upgrade the window of a bedroom. The answer I got is I cannot get a larger window, and the only option for me is to add an extra window. So I took the option. However, later I found the same model on my street (Lot 46) got the upgrade. And also, until yesterday, the extra window I purchased still not yet installed even the dry-wall has already been completed. Now I am very concerning about the impact on my home overall quality.

During the design process, the ceramic price tags were wrong. At the beginning we chosen Red class for everything. However when we start the pricing, those kinds of ceramic all need pricing and the the price we received are so much different than the Red Class price listed on the price list.  This issue had caused a big chaos during our design center phase. So an accurate price list would help buyer to well budget during the design centre phase, and I also can see this could improve Tamarack design centre productivity."
TAM0510125,"An efficient system of coordination & communication between the sales office and the design centre. The design centre is far too busy to accommodate the tight construction schedules placed on the home buyer, hence delaying the closing date (as in my case)."
TAM0512126,design centre:If they can get the prices quickly for upgrade iteams would be great.
TAM1012112,Since I bought the model home question no 2 I have no concern.  I was greeted with smiles that made me feel at home on the spot.  Congratulations.
TAM07181042,The Sales Representative - This lady she has no manners she does not say hi in emails she does not greet. She may need Greeting Training - I was called Kido a couple of times by her. I am young but its not professional. She needs to treat me with respect.
TAM0514112,"I would have liked the stairs to the deck on the opposite side.  I have a small child and would have liked the her not to run into stairs as soon as she stepped outside.  I didn't realize this until right before he plan reading.  I wish there had been more flexibility.  I was told it was too late and this had to be covered in structural meeting.
The stairs and deck has not been installed yet.  I was also told that it was easy to switch, so I could do it myself after closing.  I dont understand why this request couldnt have been accomodated."
TAM0214111,The whole process of choosing interiors of the house at the design centre seems not long enough to let you choose the best available choice. Only Christine seemed to know about all the upgrades and available choices.
TAM07181038,I would like to have some snack to share / normally the presentation is prolonged and need something to eat
TAM0716117,They need to improve their dealings with the site super and make it more accommodating for homeowners to view their homes.  Time slots  that makes sense to the homeowner (we work) - Tamarack is  not flexible at all 9am- 2pm slots    and that is it.
TAM1216114,Completely satisfied. Excellent selection and knowledge from staff
TAM0816103,A few times a different points there was less than a direct answer given to some questions that we asked and felt a little deceived or at least not fully informed and therefore taken by surprise for some costs.
TAM0912113,The Process was seemless and very well handled.  Although this was not our first time around building a home through a builder the process was very enjoyable with no surprises.  Tamarack has been very informative and a pleasure to do business with.
TAM0310102,n/a
TAM04191012,"allow the ""bonus"" money to come off the purchase price...the Tamarack standards are beautify enough!!"
TAM1211110,able to visit home more during construction
TAM08191006,That they have the right information and if they say something is to be in the home and promise to take care of the client then they should’ve.
TAM0613105,"As far as the design center is concerned, when I first went there to take a look on my own to prepare myself for my initial meeting, I felt overwhelmed and that things were disorganized.  The staff were amazing and really walked me through the entire process, when we had our final meeting we were happy with our choices and did not second guess our design decisions.  This was a seamless process with excellent customer service. Thank you"
TAM0212111,"More free offers, have a model house available so we can see, we brought the Bristol but had to drive to Kingston to see the model house."
TAM07181035,"i loved the customer service experience I had with Tamarack. The only thing I would of preferred is more of a simpler pricing list for the design center. the catalogue that is provided is long, confusing and we did not utilize it at all."
TAM1111105,"2 items:
Having the sales office open on Fridays (could be closed on Mondays). 

It would be great if the design centre made appointments in the evenings. We had to take time off from work."
TAM1211104,"We felt that some of the interactions with the sales representative at the Jackson Trails site were not completely genuine, therefore it was hard to feel comfortable at times.  Unfortunately, since there was only only one sales representative for the Jackson Trails site, there weren't any other options at the time of signing the purchase agreement. So far, the sales/signing of the agreement has been our least favourite part of our new home purchase."
TAM10191033,No comments
TAM07181017,"The design  prices are a bit high.  We bought 5 homes from diff builders and we did not want to pay 4,000 extra upgrade to put in A/C   Tamarack should at least finish the house to allow electrical copper lines to go in.  Putting an A/C costs 2,000."
TAM1014113,"Because I was the first to meet with the design center (of my development), the representative was not adequately prepared with the information regarding upgrades and standard options. This lead to confusion and poorly executed quotes for upgraded items."
TAM0111100,I wish my backsplash wasn't on back order. As I am not as happy with what I had to choose instead.
TAM12191016,nothing
TAM04182023,"- give more standard options
- i should be able to go to the sales centre and ask about the granite countertop in the main bath to the sales centre and should be able to find out what level of upgrade it is. should not have to bounce between sales centre and design centre
- also, sales centre of community i bought in is somewhat helpful after the purchase, but say you go to sales centre in another community (post purchase) just to look at the model homes - and you ask them question about the designs done therein, they are far far far from helpful. they just tell us to go and enquire in design centre"
TAM0311109,"The Muskoka kitchen modification pricing was a bit obscure and riddled with errors and double charges. Unfortunately many of our inquires directed to Muskoka were ignored to the point that we eventually gave up and had to move on.

Kim and Mandy from the design center were extremely knowledgeable and helpful, a pleasure to deal with. I can't praise Daryl enough for his help and attention to detail."
TAM0614222,"I think it would be so much more efficient and effective if all prices for upgrades were available through the design centre.  For example, the solid surfaces were not priced (by square foot) so no idea which ones were more/less expensive.  Same with the backsplash.   Full disclosure pricing would be helpful in the design process.

It would also be beneficial if there were pictures of full rooms/homes with some of the upgrades (especially flooring and cabinets).  It is hard to imagine an entire floor or full kitchen when looking at a small sample."
TAM02182003,"Thé cost of upgrade are  not explained, when questions asked to mme champagne very poor feedback, when problems with partners concept and Mondeau no help at all"
TAM0610122,Both centres were fine and the representives are kind and friendly.  i would not change a think.
TAM1013123,"It would be great if the design centre had preset design color packages put together. They have really good suggestions. 

The sales centre process is pretty good as is."
TAM1016121,More time to make design decisions.
TAM0811106,I found the process of researching kitchen sinks and faucets upgrades online on and then sending options to Tamarak for availability and pricing very frustrating. I do not live in the Kingston area so could not access the plumbing contract store locally. (The staff at the store who normally work with Tamarak clients were not available on the 2days that we were in the area purchasing our home.) It might have been easier to have been suppiled with a list of available sinks and faucets upgrades and then asked to choose from those.
TAM08171001,"Nothing, seems to work great to me!"
TAM08171021,None
TAM0615103,Informing the sales staff that ALL traffic headed to Laporte Nursery will be coming through the development.  This could easily be 1000 cars ao any spring Saturday.  Not at all hapy about that as I had to find it out from Nursery staff.  I was told this would not be a permanent  situation and it better not be as I do not want to be living on a commercial throughfare.  (That is why I purchased in a RESIDENTIAL development. ) It was almost enough for me to pull out of the deal and I am sure current buyers a d prospective ones are still not being informed of this situation.   That should have been disclosed from the beginning.  GET LAPORTES NURSERY BACK TO HAVING THEIR OWN DEDICATED ENTRANCE ASAP!!
TAM0610110,"The design center employees are extremely busy, they are rushed off their feet, I would expect they will all have nervous breakdowns!!!  This makes (through no fault of their own) a very unpleasant experience at the design centre.  It creates a very stressful atmosphere.  The appointment times are too short.  We found Kim very pleasant and helpful but she just didn't have a second to spare.  
We found dealing with Muskoka frustrating because of their incorrect knowledge of the building code and to tell you the truth  -  we've just got our fingers crossed, hoping we are going to get what we think we are getting."
TAM01181016,Had to go to work.
TAM0711137,"I am delighted with my Tamarack Home and the almost $60K in upgrades.  This clearly generates a very generous profit margin for Tamarack.  No regrets there.

Further, your records will confirm that my referral Blair Hurd has already purchased in Findlay Creek.  So as you can see I am a center of influence in my professional life and as such a valuable source of Tamarack business.  

But my referrals have come to an abrupt halt resulting which will result in a few less sales for Tamarack.  And I'd genuinely prefer to reverse that decision.

I am not happy.

There were two instances whereby I required clarification or decisions from Head Office at which point Tamarack fell into a deafening silence.  

I am a Senior Financial Planner at Investors Group and a former Partner at Doyle Salewski Inc..  I provide as well as expect a level of professionalism and I cannot accept being treated in this fashion.

So to Chris and Scott, your product is sound but my Tamarack experience remains unsatisfactory.  I have been left to feel it's Tamarack's way or 'the highway'.  

So is Tamarack responsive to its Pre-Closing Surveys?  

And in all cases to be clear, I am genuinely looking forward to taking possession of my Tamarack Home and for that I thank you.

Respectfully in your hands,

Gerald W. (Gerry)  Doyle
613.723.7200"
TAM07191007,More interest in the purchaser at the sales centre I went to them re concerns and did not receive any response. The design process went well again no response to emails sent.
TAM08171014,"I would recommend that Tamarack's design centre become more aware that not all buyers will be residents of Ottawa when they purchase their home. This only applies of course if Tamarack wants to sell homes to all potential buyers from across Canada and elsewhere. I initially got reticence about my design centre meetings as mine had to be held by phone and not in person. I don't even want to guess where I'd be if my sales person, Deborah, had not continually intervened to make things happen."
